{
  "schemaVersion": 1,
  "preset": "custom",
  "suiteName": "refactoringminer-git-regressions",
  "taskCount": 10,
  "repoName": "RefactoringMiner",
  "head": "949bddcd3509a805f5e3bcc55fcdb71a691b0dac",
  "commitCount": 5744,
  "minCommits": 1,
  "allowDirty": false,
  "dirty": false,
  "fsckOk": true,
  "validationReady": true,
  "expectedFileCount": 41,
  "expectedTestCount": 13,
  "checkedFiles": [
    "build.gradle",
    "docker/Dockerfile",
    "docker/README.md",
    "docker/native/Dockerfile-native",
    "documentation/accuracy.md",
    "documentation/mcp.md",
    "src/main/java/gr/uom/java/xmi/decomposition/ReplacementAlgorithm.java",
    "src/main/java/gr/uom/java/xmi/decomposition/UMLOperationBodyMapper.java",
    "src/main/java/gui/MarkAsViewed.java",
    "src/main/java/gui/webdiff/RunMode.java",
    "src/main/java/gui/webdiff/WebDiff.java",
    "src/main/java/gui/webdiff/dir/DirComparator.java",
    "src/main/java/gui/webdiff/dir/DirectoryDiffView.java",
    "src/main/java/gui/webdiff/viewers/spv/AbstractSinglePageView.java",
    "src/main/java/org/refactoringminer/RefactoringMiner.java",
    "src/main/java/org/refactoringminer/api/GitHistoryRefactoringMiner.java",
    "src/main/java/org/refactoringminer/astDiff/models/DiffMetaInfo.java",
    "src/main/java/org/refactoringminer/astDiff/utils/URLHelper.java",
    "src/main/java/org/refactoringminer/mcp/McpDiffBrowserResult.java",
    "src/main/java/org/refactoringminer/mcp/RefactoringMinerMcpService.java",
    "src/main/java/org/refactoringminer/mcp/RefactoringMinerMcpTools.java",
    "src/main/java/org/refactoringminer/mcp/WebDiffBrowserLauncher.java",
    "src/main/java/org/refactoringminer/rm1/GitHistoryRefactoringMinerImpl.java",
    "src/main/resources/logback.xml",
    "src/test/java/gui/MarkAsViewedTest.java",
    "src/test/java/org/refactoringminer/astDiff/utils/URLHelperTest.java",
    "src/test/java/org/refactoringminer/mcp/RefactoringMinerMcpServiceRepositoryTest.java",
    "src/test/java/org/refactoringminer/mcp/RefactoringMinerMcpToolsTest.java",
    "src/test/java/org/refactoringminer/mcp/WebDiffBrowserLauncherTest.java",
    "src/test/java/org/refactoringminer/rm1/GitHistoryRefactoringMinerImplMergeCommitTest.java",
    "src/test/java/org/refactoringminer/test/AdvancedAssertionMigrationTest.java",
    "src/test/java/org/refactoringminer/test/TestNewDatasetRefactorings.java",
    "src/test/resources/oracle/tse-dataset/lucene-solr.json"
  ],
  "missingFiles": [],
  "missingExpectedFiles": [],
  "missingExpectedTests": [],
  "setupCommandsRequired": true,
  "setupCommandReady": true,
  "tasksMissingSetupCommand": [],
  "tasksFailedSetupCommand": [],
  "tasksMissingSuccessCommand": [],
  "successCommandCheckRequested": true,
  "successCommandCheckFailFast": true,
  "successCommandCheckReady": true,
  "validationBaselineReady": true,
  "baselineSuccessCommandPassCount": 0,
  "baselineSuccessCommandFailCount": 10,
  "baselineSuccessCommandTimeoutCount": 0,
  "baselineSuccessCommandSkippedCount": 0,
  "baselineSuccessCommands": [
    {
      "taskId": "git-regression-949bddcd3509",
      "commandClass": "test",
      "commandHash": "cmd:a7e875156d1f3f1b",
      "exitStatus": 1,
      "elapsedMillis": 29614,
      "timedOut": false
    },
    {
      "taskId": "git-regression-4fa3c1a48ad4",
      "commandClass": "test",
      "commandHash": "cmd:8cc3f46d39172e10",
      "exitStatus": 1,
      "elapsedMillis": 29909,
      "timedOut": false
    },
    {
      "taskId": "git-regression-bd0b2277933f",
      "commandClass": "test",
      "commandHash": "cmd:e57bd0c7eae49943",
      "exitStatus": 1,
      "elapsedMillis": 28636,
      "timedOut": false
    },
    {
      "taskId": "git-regression-1b9f2cf08b3c",
      "commandClass": "test",
      "commandHash": "cmd:fbafca0b02f53e64",
      "exitStatus": 1,
      "elapsedMillis": 25695,
      "timedOut": false
    },
    {
      "taskId": "git-regression-092c13f035f9",
      "commandClass": "test",
      "commandHash": "cmd:382a226beca45fca",
      "exitStatus": 1,
      "elapsedMillis": 23676,
      "timedOut": false
    },
    {
      "taskId": "git-regression-fa8df046b0e0",
      "commandClass": "test",
      "commandHash": "cmd:f8d18359da0ea9cb",
      "exitStatus": 1,
      "elapsedMillis": 19887,
      "timedOut": false
    },
    {
      "taskId": "git-regression-1b04d6aae2e4",
      "commandClass": "test",
      "commandHash": "cmd:0cdfdc5ff6909a80",
      "exitStatus": 1,
      "elapsedMillis": 29253,
      "timedOut": false
    },
    {
      "taskId": "git-regression-23e298ae221c",
      "commandClass": "test",
      "commandHash": "cmd:f5b254571f2b1e85",
      "exitStatus": 1,
      "elapsedMillis": 26340,
      "timedOut": false
    },
    {
      "taskId": "git-regression-97e31265fd95",
      "commandClass": "test",
      "commandHash": "cmd:3f0859f91cc55992",
      "exitStatus": 1,
      "elapsedMillis": 24553,
      "timedOut": false
    },
    {
      "taskId": "git-regression-fa29ed0c80c8",
      "commandClass": "test",
      "commandHash": "cmd:f5b254571f2b1e85",
      "exitStatus": 1,
      "elapsedMillis": 29471,
      "timedOut": false
    }
  ],
  "evidenceUse": "outcome_ready",
  "ok": true,
  "privacy": {
    "sourceFree": true,
    "rawSourceLogged": false,
    "rawPromptLogged": false,
    "rawTranscriptLogged": false,
    "rawTerminalLogged": false
  }
}