{
  "schemaVersion": 1,
  "preset": "refactoring-miner",
  "suiteName": "refactoringminer-public",
  "taskCount": 10,
  "repoName": "RefactoringMiner",
  "head": "949bddcd3509a805f5e3bcc55fcdb71a691b0dac",
  "commitCount": 5744,
  "minCommits": 1000,
  "allowDirty": false,
  "dirty": false,
  "fsckOk": true,
  "validationReady": true,
  "expectedFileCount": 26,
  "expectedTestCount": 19,
  "checkedFiles": [
    "README.md",
    "build.gradle",
    "gradlew",
    "src/main/java/extension/ast/builder/python/PyASTBuilder.java",
    "src/main/java/extension/ast/stringifier/PyASTFlattener.java",
    "src/main/java/extension/base/LangSupportedEnum.java",
    "src/main/java/gui/MarkAsViewed.java",
    "src/main/java/gui/webdiff/viewers/spv/SinglePageView.java",
    "src/main/java/org/refactoringminer/RefactoringMiner.java",
    "src/main/java/org/refactoringminer/api/GitHistoryRefactoringMiner.java",
    "src/main/java/org/refactoringminer/astDiff/matchers/ProjectASTDiffer.java",
    "src/main/java/org/refactoringminer/astDiff/matchers/TreeMatcher.java",
    "src/main/java/org/refactoringminer/astDiff/matchers/statement/CompositeMatcher.java",
    "src/main/java/org/refactoringminer/astDiff/matchers/statement/LeafMatcher.java",
    "src/main/java/org/refactoringminer/astDiff/visitors/JdtVisitor.java",
    "src/main/java/org/refactoringminer/astDiff/visitors/JdtWithCommentsVisitor.java",
    "src/main/java/org/refactoringminer/mcp/DiffBrowserLauncher.java",
    "src/main/java/org/refactoringminer/mcp/McpAnalysisResult.java",
    "src/main/java/org/refactoringminer/mcp/McpIntentValidator.java",
    "src/main/java/org/refactoringminer/mcp/McpRefactoringResult.java",
    "src/main/java/org/refactoringminer/mcp/McpValidationResult.java",
    "src/main/java/org/refactoringminer/mcp/RefactoringMinerMcpServer.java",
    "src/main/java/org/refactoringminer/mcp/RefactoringMinerMcpService.java",
    "src/main/java/org/refactoringminer/mcp/RefactoringMinerMcpTools.java",
    "src/main/java/org/refactoringminer/mcp/WebDiffBrowserLauncher.java",
    "src/main/java/org/refactoringminer/mcp/WorktreeChangeCollector.java",
    "src/main/java/org/refactoringminer/rm1/GitHistoryRefactoringMinerImpl.java",
    "src/main/java/org/refactoringminer/util/GitServiceImpl.java",
    "src/test/java/gui/MarkAsViewedTest.java",
    "src/test/java/gui/webdiff/viewers/spv/SinglePageViewViewedFilesTest.java",
    "src/test/java/org/refactoringminer/astDiff/tests/ConsideringCommentsVisitorTest.java",
    "src/test/java/org/refactoringminer/astDiff/tests/IgnoringCommentsVisitorTest.java",
    "src/test/java/org/refactoringminer/astDiff/tests/PythonDiffTest.java",
    "src/test/java/org/refactoringminer/astDiff/tests/SpecificCasesTest.java",
    "src/test/java/org/refactoringminer/astDiff/tests/TreeFromParserTest.java",
    "src/test/java/org/refactoringminer/astDiff/tests/TreeMatcherTest.java",
    "src/test/java/org/refactoringminer/mcp/McpIntentValidatorTest.java",
    "src/test/java/org/refactoringminer/mcp/McpValidationContractTest.java",
    "src/test/java/org/refactoringminer/mcp/RefactoringMinerMcpServerStartupTest.java",
    "src/test/java/org/refactoringminer/mcp/RefactoringMinerMcpServiceRepositoryTest.java",
    "src/test/java/org/refactoringminer/mcp/RefactoringMinerMcpServiceTest.java",
    "src/test/java/org/refactoringminer/mcp/RefactoringMinerMcpToolsTest.java",
    "src/test/java/org/refactoringminer/mcp/WebDiffBrowserLauncherTest.java",
    "src/test/java/org/refactoringminer/mcp/WorktreeChangeCollectorTest.java",
    "src/test/java/org/refactoringminer/rm1/GitHistoryRefactoringMinerImplMergeCommitTest.java",
    "src/test/java/org/refactoringminer/test/TestCommandLine.java",
    "src/test/java/org/refactoringminer/util/GitServiceImplTest.java"
  ],
  "missingFiles": [],
  "missingExpectedFiles": [],
  "missingExpectedTests": [],
  "setupCommandsRequired": false,
  "setupCommandReady": true,
  "tasksMissingSetupCommand": [],
  "tasksFailedSetupCommand": [],
  "tasksMissingSuccessCommand": [],
  "successCommandCheckRequested": true,
  "successCommandCheckFailFast": true,
  "successCommandCheckReady": false,
  "validationBaselineReady": false,
  "baselineSuccessCommandPassCount": 1,
  "baselineSuccessCommandFailCount": 0,
  "baselineSuccessCommandTimeoutCount": 0,
  "baselineSuccessCommandSkippedCount": 9,
  "baselineSuccessCommands": [
    {
      "taskId": "rm-mcp-intent-validation-001",
      "commandClass": "test",
      "commandHash": "cmd:e9cca3c479fa7d5f",
      "exitStatus": 0,
      "elapsedMillis": 144473,
      "timedOut": false
    }
  ],
  "evidenceUse": "navigation_only",
  "ok": false,
  "privacy": {
    "sourceFree": true,
    "rawSourceLogged": false,
    "rawPromptLogged": false,
    "rawTranscriptLogged": false,
    "rawTerminalLogged": false
  }
}